Plugin ID,CVE,CVSS,Risk,Host,Protocol,Port,Name,Synopsis,Description,Solution,See Also,Plugin Output,,,Low,matthews-laptop.local,,,,,,Update to Apache Tomcat version 7.0.52 or later.,,The remote Apache Tomcat service may be affected by a denial of service vulnerability.,,,Medium,matthews-laptop.local,,,,,,"If using WebSphere Application Server, apply Fix Pack 11 (7.0.0.11) or later. ",,The remote application server is affected by multiple vulnerabilities.,,,Medium,simon-iphone.local,,,,,,"If FrontPage is being used to administer the website, tighten the permissions. If not, remove the _vti_* directories and _vti_inf.html.",,The remote web server is configured insecurely.,,,Medium,simon-iphone.local,,,,,,See: http://technet.microsoft.com/en-us/security/bulletin/ms00-006.,,The remote web server is affected by an information disclosure vulnerability.,,,High,simon-iphone.local,,,,,,Upgrade to mod_survey 3.0.14e / 3.0.15pre6 or later.,,The web server module on the remote host has a SQL injection vulnerability.,,,High,elenas-ipad.local,,,,,,Upgrade to NaviCOPA 3.01 from 6th February 2009 or later as that reportedly resolves the issues.,,The remote web server is affected by multiple vulnerabilities.,,,High,elenas-ipad.local,,,,,,Upgrade to OpenSSL 0.9.8j or later.,,The remote server is affected by a signature validation bypass vulnerability.,,,Critical,elenas-ipad.local,,,,,,Fix the application so that the session cookie is re-generated after a successful authentication. Fix the cookie manipulation flaws.,,The remote web application is vulnerable to a session fixation attack.